<?xml version="1.0" encoding="UTF-8"?>
<!-- Default configuration for dhis2-live -->
<!-- Bob Jolliffe 07/09/2010 -->

<Config xmlns:xsi="http://www.w3.org/2001/XMLSchema-instance"
 xsi:schemaLocation="http://www.dhis.org/schema/config Config.xsd"
 xmlns="http://www.dhis.org/schema/config">
    <AppConfiguration>
        <LocaleLanguage>en</LocaleLanguage>
        <LocaleCountry>GB</LocaleCountry>
        <Port>8080</Port>
        <Host>localhost</Host>
        <PreferredBrowser/>
        <MaxFormContentSize>200000</MaxFormContentSize>
    </AppConfiguration>
    <DatabaseConfiguration>
        <ConnectionTypes>
            <ConnectionType id="h2">
                <Dialect>org.hisp.dhis.dialect.H2Dialect</Dialect>
                <DriverClass>org.h2.Driver</DriverClass>
            </ConnectionType>
            <ConnectionType id="mysql">
                <Dialect>org.hibernate.dialect.MySQLDialect</Dialect>
                <DriverClass>com.mysql.jdbc.Driver</DriverClass>
            </ConnectionType>
            <ConnectionType id="postgres">
                <Dialect>org.hibernate.dialect.PostgreSQLDialect</Dialect>
                <DriverClass>org.postgresql.Driver</DriverClass>
            </ConnectionType>
        </ConnectionTypes>
        <DatabaseConnections selected="conn1">
            <Connection id="conn1" type="h2">
                <Name>DHIS2 Demo</Name>
                <URL>jdbc:h2:./database/demo;AUTO_SERVER=TRUE</URL>
                <UserName>sa</UserName>
            </Connection>
        </DatabaseConnections>
    </DatabaseConfiguration>
</Config>
